{
  "$schema": "../schemas/core-profile.schema.json",
  "profile_id": "core-v1",
  "status": "candidate",
  "core_api_generation": 1,
  "abstract_symbols": [
    { "id": "context", "kind": "type", "introduced": 1, "deprecated_since": null, "replacement": null, "earliest_removal": null },
    { "id": "source", "kind": "type", "introduced": 1, "deprecated_since": null, "replacement": null, "earliest_removal": null },
    { "id": "computed", "kind": "type", "introduced": 1, "deprecated_since": null, "replacement": null, "earliest_removal": null },
    { "id": "effect", "kind": "type", "introduced": 1, "deprecated_since": null, "replacement": null, "earliest_removal": null },
    { "id": "batch", "kind": "operation", "introduced": 1, "deprecated_since": null, "replacement": null, "earliest_removal": null },
    { "id": "scope", "kind": "operation", "introduced": 1, "deprecated_since": null, "replacement": null, "earliest_removal": null },
    { "id": "typed_context", "kind": "type", "introduced": 1, "deprecated_since": null, "replacement": null, "earliest_removal": null }
  ],
  "proof_classes": {
    "fixture_replay": {
      "description": "The binding executes every named fixture and scenario with no unexplained skip.",
      "fixture_required": true
    },
    "native_artifact_consumer": {
      "description": "A clean consumer builds and invokes the shipped native artifact boundary.",
      "fixture_required": false
    },
    "package_api": {
      "description": "The declared symbol is visible from the shipped package import and matches its API snapshot.",
      "fixture_required": false
    }
  },
  "required_fixtures": [
    { "path": "reactive-graph/churn_returns_to_baseline.json", "scenario_ids": [], "proof_classes": ["fixture_replay"] },
    { "path": "reactive-graph/cross_scope_teardown_hazard.json", "scenario_ids": [], "proof_classes": ["fixture_replay"] },
    { "path": "reactive-graph/disarm_disposes_nothing.json", "scenario_ids": [], "proof_classes": ["fixture_replay"] },
    { "path": "reactive-graph/disposal_does_not_run_surviving_effects.json", "scenario_ids": [], "proof_classes": ["fixture_replay"] },
    { "path": "reactive-graph/dispose_detaches_edges_both_directions.json", "scenario_ids": [], "proof_classes": ["fixture_replay"] },
    { "path": "reactive-graph/dispose_signal_reverts_to_lazy.json", "scenario_ids": [], "proof_classes": ["fixture_replay"] },
    { "path": "reactive-graph/failed_compute_is_never_cached.json", "scenario_ids": [], "proof_classes": ["fixture_replay"] },
    { "path": "reactive-graph/feedback_drain_bound_reports_exhaustion.json", "scenario_ids": [], "proof_classes": ["fixture_replay"] },
    { "path": "reactive-graph/read_after_dispose_is_an_error.json", "scenario_ids": [], "proof_classes": ["fixture_replay"] },
    { "path": "reactive-graph/recycled_id_inherits_nothing.json", "scenario_ids": [], "proof_classes": ["fixture_replay"] },
    { "path": "reactive-graph/stale_effect_handle_cannot_remove_recycled_source.json", "scenario_ids": ["stale_cell_to_cell", "stale_cell_to_computed", "stale_cell_to_effect", "stale_computed_to_cell", "stale_computed_to_computed", "stale_computed_to_effect", "stale_effect_to_cell", "stale_effect_to_computed", "stale_effect_to_effect"], "proof_classes": ["fixture_replay"] },
    { "path": "reactive-graph/scope_teardown_equals_fold_of_disposals.json", "scenario_ids": ["scope_teardown", "individual_disposal"], "proof_classes": ["fixture_replay"] },
    { "path": "reactive-graph/scoping_bounds_teardown_not_visibility.json", "scenario_ids": [], "proof_classes": ["fixture_replay"] },
    { "path": "reactive-graph/signal_materializes_once_per_batch.json", "scenario_ids": [], "proof_classes": ["fixture_replay"] },
    { "path": "reactive-graph/signal_materializes_without_a_read.json", "scenario_ids": [], "proof_classes": ["fixture_replay"] },
    { "path": "reactive-graph/teardown_runs_members_in_reverse_creation_order.json", "scenario_ids": [], "proof_classes": ["fixture_replay"] },
    { "path": "reactive-graph/transitive_invalidation_reaches_depth.json", "scenario_ids": [], "proof_classes": ["fixture_replay"] }
  ],
  "fixture_corpus": {
    "algorithm": "sha256-path-nul-bytes-v1",
    "digest": "db3eb69f96061a8bd49a4f8018baf823bac0edca3f44c0fb1c0dba54e4f846e9"
  },
  "coverage": {
    "core_row_ids": ["reactive-graph", "thread-safe-context", "async-reactive-context"]
  },
  "capability_exclusions": {
    "coverage_families": [
      "materialization", "familysync", "statechart", "collections", "queue", "topic",
      "work-queue", "crdt", "lossless-tree", "egress", "ingress", "codec", "transport",
      "message-passing", "reliable-sync", "durable-owner", "durable-capability", "distributed",
      "receipts", "security", "membership", "coordination", "presence", "temporal", "rateshape",
      "windowing", "resilience", "stdlib", "service", "instrumentation"
    ],
    "public_symbols": [
      "SourceMap", "ComputedMap", "StateChart", "QueueCell", "TopicCell", "WorkQueueCell",
      "TextCrdt", "RelayCell", "IngressCell", "EgressCore", "TimerCell", "IpcMessage",
      "ShmBlobArena", "MergePolicy", "ReactAdapter", "R3Adapters"
    ]
  },
  "bindings": [
    {
      "id": "rust", "language": "Rust", "maturity": "candidate",
      "execution_flavors": ["single_threaded", "thread_safe", "async"],
      "imports": [{ "id": "root", "path": "lazily", "kind": "root" }],
      "symbol_mappings": {
        "context": { "import_id": "root", "public_names": ["Context"] },
        "source": { "import_id": "root", "public_names": ["Source"] },
        "computed": { "import_id": "root", "public_names": ["Computed"] },
        "effect": { "import_id": "root", "public_names": ["Effect"] },
        "batch": { "import_id": "root", "public_names": ["Context::batch"] },
        "scope": { "import_id": "root", "public_names": ["Context::scope", "TeardownScope"] },
        "typed_context": { "import_id": "root", "public_names": ["TypedContext"] }
      },
      "required_fixtures": ["reactive-graph/churn_returns_to_baseline.json", "reactive-graph/cross_scope_teardown_hazard.json", "reactive-graph/disarm_disposes_nothing.json", "reactive-graph/disposal_does_not_run_surviving_effects.json", "reactive-graph/dispose_detaches_edges_both_directions.json", "reactive-graph/dispose_signal_reverts_to_lazy.json", "reactive-graph/failed_compute_is_never_cached.json", "reactive-graph/feedback_drain_bound_reports_exhaustion.json", "reactive-graph/read_after_dispose_is_an_error.json", "reactive-graph/recycled_id_inherits_nothing.json", "reactive-graph/stale_effect_handle_cannot_remove_recycled_source.json", "reactive-graph/scope_teardown_equals_fold_of_disposals.json", "reactive-graph/scoping_bounds_teardown_not_visibility.json", "reactive-graph/signal_materializes_once_per_batch.json", "reactive-graph/signal_materializes_without_a_read.json", "reactive-graph/teardown_runs_members_in_reverse_creation_order.json", "reactive-graph/transitive_invalidation_reaches_depth.json"],
      "fixtureless_claims": [{ "id": "c_abi_ffi_boundary", "scope": "module", "proof_classes": ["native_artifact_consumer"] }],
      "toolchains": { "minimum": { "name": "rust", "version": "1.88" }, "current": { "name": "rust", "version": "stable" } },
      "support_range": { "minimum_core_api_generation": 1, "maximum_core_api_generation": 1 }
    },
    {
      "id": "python", "language": "Python", "maturity": "candidate",
      "execution_flavors": ["single_threaded", "thread_safe", "async"],
      "imports": [{ "id": "root", "path": "lazily", "kind": "root" }],
      "symbol_mappings": {
        "context": { "import_id": "root", "public_names": ["Context"] },
        "source": { "import_id": "root", "public_names": ["Source"] },
        "computed": { "import_id": "root", "public_names": ["Computed"] },
        "effect": { "import_id": "root", "public_names": ["Effect"] },
        "batch": { "import_id": "root", "public_names": ["batch", "AsyncContext.batch"] },
        "scope": { "import_id": "root", "public_names": ["teardown_scope", "AsyncContext.scope"] },
        "typed_context": { "import_id": "root", "public_names": ["Context"] }
      },
      "required_fixtures": ["reactive-graph/churn_returns_to_baseline.json", "reactive-graph/cross_scope_teardown_hazard.json", "reactive-graph/disarm_disposes_nothing.json", "reactive-graph/disposal_does_not_run_surviving_effects.json", "reactive-graph/dispose_detaches_edges_both_directions.json", "reactive-graph/dispose_signal_reverts_to_lazy.json", "reactive-graph/failed_compute_is_never_cached.json", "reactive-graph/feedback_drain_bound_reports_exhaustion.json", "reactive-graph/read_after_dispose_is_an_error.json", "reactive-graph/recycled_id_inherits_nothing.json", "reactive-graph/stale_effect_handle_cannot_remove_recycled_source.json", "reactive-graph/scope_teardown_equals_fold_of_disposals.json", "reactive-graph/scoping_bounds_teardown_not_visibility.json", "reactive-graph/signal_materializes_once_per_batch.json", "reactive-graph/signal_materializes_without_a_read.json", "reactive-graph/teardown_runs_members_in_reverse_creation_order.json", "reactive-graph/transitive_invalidation_reaches_depth.json"],
      "fixtureless_claims": [],
      "toolchains": { "minimum": { "name": "python", "version": "3.12" }, "current": { "name": "python", "version": "3.14" } },
      "support_range": { "minimum_core_api_generation": 1, "maximum_core_api_generation": 1 }
    },
    {
      "id": "kotlin", "language": "Kotlin", "maturity": "candidate",
      "execution_flavors": ["single_threaded", "thread_safe", "async"],
      "imports": [{ "id": "root", "path": "io.github.lazily", "kind": "package" }],
      "symbol_mappings": {
        "context": { "import_id": "root", "public_names": ["Context"] },
        "source": { "import_id": "root", "public_names": ["Source"] },
        "computed": { "import_id": "root", "public_names": ["Computed"] },